{
  "$schema": "https://json-schema.org/draft/2020-12/schema",
  "$id": "https://volmit.com/gloss/entity-overlays.schema.json",
  "title": "Gloss Entity Overlays Document",
  "description": "Default nearby living-entity overlays at plugins/Gloss/entity-overlays/default.json, with segmented health, custom names, damage feedback, combat stats and optional React/Adapt data.",
  "type": "object",
  "required": [
    "schemaVersion",
    "revision"
  ],
  "properties": {
    "preset": {
      "type": [
        "string",
        "null"
      ],
      "minLength": 1
    },
    "schemaVersion": {
      "type": "integer",
      "const": 2
    },
    "revision": {
      "type": "integer",
      "minimum": 1,
      "maximum": 9007199254740991
    },
    "enabled": {
      "type": "boolean",
      "default": true
    },
    "range": {
      "type": "number",
      "default": 16,
      "description": "Nearby range in blocks; clamped to 1..64."
    },
    "updateIntervalTicks": {
      "type": "integer",
      "default": 5,
      "description": "Update interval in ticks; clamped to 1..40."
    },
    "maxEntitiesPerViewer": {
      "type": "integer",
      "default": 16,
      "description": "Maximum overlays per viewer; clamped to 1..256."
    },
    "maxActiveOverlays": {
      "type": "integer",
      "minimum": 16,
      "maximum": 16384,
      "default": 1024,
      "description": "Server-wide cap on simultaneously tracked entity overlays, admitting the nearest targets first; clamped to 16..16384."
    },
    "includePlayers": {
      "type": "boolean",
      "default": true
    },
    "overrideNametag": {
      "type": "boolean",
      "default": false,
      "description": "Hide native mob nametags for viewers whose Gloss overlay displays the mob name."
    },
    "verticalOffset": {
      "type": "number",
      "default": 0.35,
      "description": "Blocks above entity bounds; clamped to -2..8."
    },
    "healthSegments": {
      "type": "integer",
      "default": 10,
      "description": "Health bar segments; clamped to 1..40."
    },
    "hitHighlightMs": {
      "type": "integer",
      "default": 750,
      "description": "Recent-hit highlight in milliseconds; clamped to 0..10000."
    },
    "blacklistWorlds": {
      "type": "array",
      "items": {
        "type": "string"
      },
      "default": []
    },
    "excludedEntityTypes": {
      "type": "array",
      "items": {
        "type": "string"
      },
      "default": [
        "ARMOR_STAND"
      ]
    },
    "show": {
      "$ref": "#/$defs/show",
      "default": true
    },
    "lines": {
      "type": "array",
      "maxItems": 64,
      "items": {
        "$ref": "#/$defs/line"
      },
      "description": "Ordered rows. Text rows use the Gloss text engine; insight rows expand Adapt details; spacers reserve one blank row. IDs must be unique."
    },
    "style": {
      "$ref": "#/$defs/iconDisplayStyle",
      "description": "Native Gloss TextDisplay style. An omitted style uses center billboard and scale 0.75 on every axis. Fields omitted from an explicit style use native IconDisplayStyle defaults."
    },
    "box": {
      "$ref": "#/$defs/box"
    },
    "particleLayers": {
      "type": "array",
      "maxItems": 64,
      "items": {
        "$ref": "#/$defs/particleLayer"
      },
      "default": []
    },
    "healthBar": {
      "$ref": "#/$defs/healthBar"
    },
    "variants": {
      "type": "array",
      "maxItems": 64,
      "items": {
        "$ref": "#/$defs/variant"
      },
      "default": [],
      "description": "First matching presentation by descending priority, then id. Omitted fields inherit the base presentation."
    },
    "snapshotReadLimit": {
      "type": "integer",
      "minimum": 16,
      "maximum": 65536,
      "default": 4096,
      "description": "Maximum distinct captured role fields and provider calls per sampled entity."
    }
  },
  "$defs": {
    "iconDisplayStyle": {
      "title": "Icon Display Style",
      "description": "Optional display-entity metadata shared by text, image, item, block, and custom-item icons. Packet entity icons do not accept this object.",
      "type": "object",
      "dependentRequired": {
        "blockLight": [
          "skyLight"
        ],
        "skyLight": [
          "blockLight"
        ]
      },
      "properties": {
        "billboard": {
          "type": "string",
          "enum": [
            "fixed",
            "vertical",
            "horizontal",
            "center"
          ],
          "default": "fixed"
        },
        "shadow": {
          "type": "boolean",
          "default": false
        },
        "seeThrough": {
          "type": "boolean",
          "default": false
        },
        "textAlignment": {
          "type": "string",
          "enum": [
            "center",
            "left",
            "right"
          ],
          "default": "center"
        },
        "backgroundArgb": {
          "type": "string",
          "pattern": "^#[0-9A-Fa-f]{8}$",
          "default": "#00000000"
        },
        "textOpacity": {
          "type": "integer",
          "minimum": 0,
          "maximum": 255,
          "default": 255
        },
        "lineWidth": {
          "type": "integer",
          "minimum": 1,
          "maximum": 16384,
          "default": 16384
        },
        "blockLight": {
          "type": [
            "integer",
            "null"
          ],
          "minimum": 0,
          "maximum": 15
        },
        "skyLight": {
          "type": [
            "integer",
            "null"
          ],
          "minimum": 0,
          "maximum": 15
        },
        "viewRange": {
          "type": "number",
          "minimum": 0.01,
          "maximum": 64,
          "default": 1
        },
        "shadowRadius": {
          "type": "number",
          "minimum": 0,
          "maximum": 64,
          "default": 0
        },
        "shadowStrength": {
          "type": "number",
          "minimum": 0,
          "maximum": 1,
          "default": 0
        },
        "cullingWidth": {
          "type": "number",
          "minimum": 0,
          "maximum": 4096,
          "default": 0
        },
        "cullingHeight": {
          "type": "number",
          "minimum": 0,
          "maximum": 4096,
          "default": 0
        },
        "glowColor": {
          "type": [
            "string",
            "null"
          ],
          "pattern": "^#[0-9A-Fa-f]{8}$"
        },
        "scaleX": {
          "type": "number",
          "minimum": 0.01,
          "maximum": 64,
          "default": 1
        },
        "scaleY": {
          "type": "number",
          "minimum": 0.01,
          "maximum": 64,
          "default": 1
        },
        "scaleZ": {
          "type": "number",
          "minimum": 0.01,
          "maximum": 64,
          "default": 1
        }
      },
      "additionalProperties": false
    },
    "particleLayer": {
      "type": "object",
      "required": [
        "id",
        "target",
        "geometry",
        "particle"
      ],
      "properties": {
        "id": {
          "type": "string",
          "pattern": "^[a-z0-9][a-z0-9._-]{0,63}$"
        },
        "target": {
          "type": "object",
          "required": [
            "scope"
          ],
          "properties": {
            "scope": {
              "enum": [
                "projection",
                "component",
                "text",
                "line",
                "span",
                "label",
                "model",
                "local"
              ]
            },
            "name": {
              "type": "string",
              "pattern": "^[a-z0-9][a-z0-9._-]{0,63}$"
            },
            "component": {
              "type": "string",
              "pattern": "^[a-z0-9][a-z0-9._-]{0,63}$"
            },
            "line": {
              "type": "integer",
              "minimum": 1
            }
          }
        },
        "geometry": {
          "type": "object",
          "required": [
            "type"
          ],
          "properties": {
            "type": {
              "enum": [
                "point",
                "line",
                "polyline",
                "outline",
                "filledPlane",
                "cuboid",
                "letterBounds",
                "glyphOutline",
                "glyphFill"
              ]
            },
            "from": {
              "$ref": "#/$defs/vector3"
            },
            "to": {
              "$ref": "#/$defs/vector3"
            },
            "points": {
              "type": "array",
              "items": {
                "$ref": "#/$defs/vector3"
              }
            },
            "width": {
              "type": "number",
              "minimum": 0,
              "maximum": 128
            },
            "height": {
              "type": "number",
              "minimum": 0,
              "maximum": 128
            },
            "depth": {
              "type": "number",
              "minimum": 0,
              "maximum": 128
            },
            "padding": {
              "type": "number",
              "minimum": 0,
              "maximum": 16
            },
            "spacing": {
              "type": "number",
              "minimum": 0.02,
              "maximum": 16
            }
          }
        },
        "placement": {
          "type": "object",
          "properties": {
            "layer": {
              "enum": [
                "behind",
                "front",
                "center"
              ]
            },
            "depth": {
              "type": "number",
              "minimum": 0,
              "maximum": 16
            },
            "offset": {
              "$ref": "#/$defs/vector3"
            }
          }
        },
        "particle": {
          "type": "object",
          "required": [
            "key"
          ],
          "properties": {
            "key": {
              "type": "string",
              "pattern": "^[a-z0-9_.-]+:[a-z0-9_./-]+$"
            },
            "color": {
              "type": "string",
              "pattern": "^#[0-9A-Fa-f]{6}$"
            },
            "size": {
              "type": "number",
              "minimum": 0.01,
              "maximum": 4
            },
            "count": {
              "type": "integer",
              "minimum": 1,
              "maximum": 64,
              "default": 1,
              "description": "Particles emitted at each sampled point; every particle counts against the emission budget."
            },
            "speed": {
              "type": "number",
              "minimum": 0,
              "maximum": 10,
              "default": 0,
              "description": "Particle velocity multiplier."
            },
            "spread": {
              "type": "array",
              "items": {
                "type": "number",
                "minimum": 0,
                "maximum": 16,
                "default": 0
              },
              "minItems": 3,
              "maxItems": 3,
              "default": [
                0,
                0,
                0
              ],
              "description": "Random particle offsets along the x, y and z axes."
            }
          }
        },
        "emission": {
          "type": "object",
          "properties": {
            "intervalTicks": {
              "type": "integer",
              "minimum": 1,
              "maximum": 200
            },
            "pattern": {
              "enum": [
                "steady",
                "chase",
                "pulse",
                "twinkle",
                "scan",
                "corners"
              ]
            },
            "periodTicks": {
              "type": "integer",
              "minimum": 1,
              "maximum": 72000
            },
            "seed": {
              "type": "integer"
            }
          }
        },
        "priority": {
          "type": "integer",
          "minimum": -1000,
          "maximum": 1000
        },
        "viewDistance": {
          "type": "number",
          "minimum": 4,
          "maximum": 128,
          "default": 48,
          "description": "Maximum distance in blocks at which this layer emits for a viewer."
        },
        "show": {
          "oneOf": [
            {
              "type": "boolean"
            },
            {
              "type": "string"
            }
          ],
          "default": true,
          "description": "Boolean or viewer condition controlling whether this layer emits."
        }
      }
    },
    "vector3": {
      "title": "3D Vector",
      "description": "Represents a 3D floating-point vector.",
      "type": "array",
      "minItems": 3,
      "maxItems": 3,
      "items": {
        "type": "number"
      }
    },
    "show": {
      "oneOf": [
        {
          "type": "boolean"
        },
        {
          "type": "string",
          "minLength": 1
        }
      ],
      "description": "Boolean or Gloss boolean expression. Entity variables include entity.name, named, type, health, maxHealth, healthPercent (0..100), damage, damaged, attack, armor, stackCount, distance, and insight.active. Viewer, world, server, time, permissions, groups, regions and integration functions use the shared condition scope."
    },
    "line": {
      "type": "object",
      "required": [
        "id"
      ],
      "properties": {
        "id": {
          "type": "string",
          "pattern": "^[a-z0-9][a-z0-9._-]{0,63}$"
        },
        "type": {
          "enum": [
            "text",
            "insight",
            "spacer"
          ],
          "default": "text"
        },
        "text": {
          "type": "string",
          "maxLength": 4096,
          "description": "Gloss functions, expressions, PlaceholderAPI, emoji, colors, MiniMessage, animations and particle spans. Tokens: {name}, {type}, {bar}, {health}, {max_health}, {count}, {attack}, {armor}, {damage}, {distance}, {insight}. Entity names, Insight details and expression results are literal data with legacy colors."
        },
        "show": {
          "$ref": "#/$defs/show",
          "default": true
        }
      }
    },
    "box": {
      "type": "object",
      "properties": {
        "enabled": {
          "type": "boolean",
          "default": false
        },
        "padding": {
          "type": "integer",
          "minimum": 0,
          "maximum": 64,
          "default": 4
        },
        "borderWidth": {
          "type": "integer",
          "minimum": 0,
          "maximum": 16,
          "default": 1
        },
        "backgroundArgb": {
          "type": "string",
          "pattern": "^#[0-9A-Fa-f]{8}$",
          "default": "#B31B1B22"
        },
        "borderArgb": {
          "type": "string",
          "pattern": "^#[0-9A-Fa-f]{8}$",
          "default": "#FFAAAAAA"
        }
      }
    },
    "healthBar": {
      "type": "object",
      "additionalProperties": false,
      "properties": {
        "glyph": {
          "type": "string"
        },
        "emptyGlyph": {
          "type": "string"
        },
        "healthyColor": {
          "type": "string"
        },
        "warningColor": {
          "type": "string"
        },
        "criticalColor": {
          "type": "string"
        },
        "damageColor": {
          "type": "string"
        },
        "emptyColor": {
          "type": "string"
        },
        "warningThreshold": {
          "type": "number",
          "minimum": 0,
          "maximum": 1
        },
        "criticalThreshold": {
          "type": "number",
          "minimum": 0,
          "maximum": 1
        },
        "decimals": {
          "type": "integer",
          "minimum": 0,
          "maximum": 6,
          "default": 1
        }
      }
    },
    "variantPresentation": {
      "type": "object",
      "properties": {
        "lines": {
          "type": "array",
          "maxItems": 64,
          "items": {
            "$ref": "#/$defs/line"
          },
          "description": "Ordered rows. Text rows use the Gloss text engine; insight rows expand Adapt details; spacers reserve one blank row. IDs must be unique."
        },
        "style": {
          "$ref": "#/$defs/iconDisplayStyle",
          "description": "Native Gloss TextDisplay style. An omitted style uses center billboard and scale 0.75 on every axis. Fields omitted from an explicit style use native IconDisplayStyle defaults."
        },
        "box": {
          "$ref": "#/$defs/box"
        },
        "particleLayers": {
          "type": "array",
          "maxItems": 64,
          "items": {
            "$ref": "#/$defs/particleLayer"
          },
          "default": []
        },
        "verticalOffset": {
          "type": "number",
          "default": 0.35,
          "description": "Blocks above entity bounds; clamped to -2..8."
        },
        "healthSegments": {
          "type": "integer",
          "default": 10,
          "description": "Health bar segments; clamped to 1..40."
        },
        "healthBar": {
          "$ref": "#/$defs/healthBar"
        }
      },
      "additionalProperties": false
    },
    "variant": {
      "type": "object",
      "required": [
        "id",
        "when",
        "presentation"
      ],
      "properties": {
        "id": {
          "type": "string",
          "pattern": "^[a-z0-9][a-z0-9._-]{0,63}$"
        },
        "priority": {
          "type": "integer",
          "minimum": -1000,
          "maximum": 1000,
          "default": 0
        },
        "when": {
          "type": "string",
          "description": "Condition selecting this presentation for the viewer."
        },
        "presentation": {
          "$ref": "#/$defs/variantPresentation"
        }
      },
      "additionalProperties": false
    }
  }
}
